ItemID,Type,Tags,Name,RUID,Guide,Guide(ko),SpecialAbility,StatusEffect_1,StatusEffect_2,PhysicalAttack,MagicalAttack,MaxHP,MaxMP,MP,Defence,MagicalResistance,AttackSpeed,AttackRange,CriticalPercent,CriticalDamagePercent,BloodAbsorptionPercent,MoveSpeed
IB00001,Box,,재료 아이템 상자,be88af6c794f4e129e1a88ea828cbc8d,ItemGuide_1,아이템 선택 획득,무작위로 3개의 기본 아이템 중 1개를 선택해 획득합니다.,,,,,,,,,,,,,,,
IB00002,Box,Attacker,공격형 재료 아이템 상자,6041e5461e5b4ff8837f967f4a39af43,ItemGuide_1,아이템 선택 획득,무작위 공격 재료 아이템 3종 중 1개를 선택해 획득합니다.,,,,,,,,,,,,,,,
IB00003,Box,Defender,방어형 재료 아이템 상자,c48e70fab797421ead1087308e835206,ItemGuide_1,아이템 선택 획득,무작위 방어 재료 아이템 3종 중 1개를 선택해 획득합니다.,,,,,,,,,,,,,,,
IB00004,Box,,완성 아이템 상자,4402474191d34188b1fe0593f2993ee1,ItemGuide_1,아이템 선택 획득,무작위 완성 아이템 3종 중 1개를 선택해 획득합니다.,,,,,,,,,,,,,,,
IB00005,Box,MI10001,힘의 완성 아이템 상자,7317a8ae042745d584f1b6c1654c2c37,ItemGuide_1,아이템 선택 획득,카알 대검(공격력)을 재료로 하는 무작위 완성 아이템 3종 중 1개를 선택해 획득합니다.,,,,,,,,,,,,,,,
IB00006,Box,MI10002,민첩함의 완성 아이템 상자,5edb7df8c4f04443ab2bd31ac2a5c1e1,ItemGuide_1,아이템 선택 획득,워보우(공격속도)를 재료로 하는 무작위 완성 아이템 3종 중 1개를 선택해 획득합니다.,,,,,,,,,,,,,,,
IB00007,Box,MI10003,단단한 완성 아이템 상자,115a712d6f5b430195f4f055c390afb4,ItemGuide_1,아이템 선택 획득,나무 방패(물리 방어력)를 재료로 하는 무작위 완성 아이템 3종 중 1개를 선택해 획득합니다.,,,,,,,,,,,,,,,
IB00008,Box,MI10004,현명함의 완성 아이템 상자,dc5eb5e0047a47cf9ea7d9e2911dd8af,ItemGuide_1,아이템 선택 획득,낡은 고깔 모자(마법 방어력)를 재료로 하는 무작위 완성 아이템 3종 중 1개를 선택해 획득합니다.,,,,,,,,,,,,,,,
IB00009,Box,MI10005,지혜의 완성 아이템 상자,7e6fdf416e8b420781de320330fb36cb,ItemGuide_1,아이템 선택 획득,고목나무 스태프(마력)를 재료로 하는 무작위 완성 아이템 3종 중 1개를 선택해 획득합니다.,,,,,,,,,,,,,,,
IB00010,Box,MI10006,충만함의 완성 아이템 상자,bbf9bbf0c2c4443e807dbb0fa8a8085e,ItemGuide_1,아이템 선택 획득,허름한 망토(시작 MP)를 재료로 하는 무작위 완성 아이템 3종 중 1개를 선택해 획득합니다.,,,,,,,,,,,,,,,
IB00011,Box,MI10007,단단함의 완성 아이템 상자,2db8e4db477945b997bec0c2096525f0,ItemGuide_1,아이템 선택 획득,노가다 목장갑(HP Max)를 재료로 하는 무작위 완성 아이템 3종 중 1개를 선택해 획득합니다.,,,,,,,,,,,,,,,
IB00012,Box,MI10008,치명적인 완성 아이템 상자,9316ee76a41e4e8f8d3a2fbc946caf56,ItemGuide_1,아이템 선택 획득,추 귀고리(크리티컬 확률)를 재료로 하는 무작위 완성 아이템 3종 중 1개를 선택해 획득합니다.,,,,,,,,,,,,,,,
IB00013,Box,,소모 아이템 상자,1291577727404261901f2bfe4ab996f3,ItemGuide_1,아이템 선택 획득,무작위 소모 아이템 3종 중 1개를 선택해 획득합니다.,,,,,,,,,,,,,,,
IB00014,Box,,메달 상자,d89f782cdca5431bbfaef72648396255,ItemGuide_2,메달 선택 획득,무작위 메달 아이템 4개 중 1개를 선택해 획득합니다. <i>메달 아이템을 장착하면 해당 시너지를 획득합니다. </i>,,,,,,,,,,,,,,,
CI0001,Consumable,Normal,카르마의 가위,06a4091b1eb34d7a9cc98c2d9f955e15,ItemGuide_3,아이템 장착 해제,아이템을 장착한 캐릭터에게 사용하면 해당 유닛이 장착한 아이템들을 모두 인벤토리에 꺼냅니다.,,,,,,,,,,,,,,,
CI0002,Consumable,Special,황금 카르마의 가위,17f357b7b92e44efa4bc7b2f9cd190d7,ItemGuide_3,아이템 장착 해제,아이템을 장착한 캐릭터에게 사용하면 해당 유닛이 장착한 아이템들을 모두 인벤토리에 꺼냅니다. 무한정 사용할 수 있습니다.,,,,,,,,,,,,,,,
CI0003,Consumable,Rare,검은 보따리,b600a96f4b8a4fdb812721dc9b28d777,ItemGuide_4,캐릭터 복사,"1~2코스트 캐릭터에게 사용하여, 동일한 1성 캐릭터를 하나 얻을 수 있습니다.",,,,,,,,,,,,,,,
CI0004,Consumable,Epic,푸른 보따리,15734459589041bbae287fe10fea5783,ItemGuide_4,캐릭터 복사,"1~4코스트 캐릭터에게 사용하여, 동일한 1성 캐릭터를 하나 얻을 수 있습니다.",,,,,,,,,,,,,,,
CI0005,Consumable,Epic,황금 보따리,c9ffced7362d4e86815ce8defe209a54,ItemGuide_4,캐릭터 복사,"1~5코스트 캐릭터에게 사용하여, 동일한 1성 캐릭터를 하나 얻을 수 있습니다.",,,,,,,,,,,,,,,
CI0006,Consumable,Normal,나무 변환망치,6a758973146c4d509e1c2e216437741d,ItemGuide_5,아이템 무작위 변경,"아이템을 장착한 캐릭터에게 사용하여, 장착한 아이템들을 무작위 아이템으로 변환할 수 있습니다. 변환된 아이템은 장착 해제되어, 인벤토리로 돌아갑니다.",,,,,,,,,,,,,,,
CI0007,Consumable,Rare,황금 변환망치,1cf72cc57d6e4daf9851fc4b89c839d3,ItemGuide_6,아이템 상자로 변경,"아이템을 장착한 캐릭터에게 사용하여, 장착한 아이템들을 아이템 상자로 변환할 수 있습니다. 변환된 아이템은 장착 해제되어, 인벤토리로 돌아갑니다.",,,,,,,,,,,,,,,
CI0008,Consumable,Rare,수상한 초대장,ca7658a7f9064e2a8e5d3018d5e365ce,ItemGuide_7,캐릭터 시너지 상점,상점을 새로고침하여 대상 유닛과 시너지를 공유하는 캐릭터들로만 채웁니다.,,,,,,,,,,,,,,,
CI0009,Consumable,Epic,거짓말 탐지기,9c41867bd2b44df194cba7a711b9b5f6,ItemGuide_8,상점에서 캐릭터 등장 안함,남은 게임동안 해당 캐릭터가 상점에서 등장하지 않습니다.,,,,,,,,,,,,,,,
CI0010,Consumable,Special,하트,3b62b4a06805422f8863068f22526d89,ItemGuide_9,팀 체력 회복,팀 체력을 1 회복합니다.,,,,,,,,,,,,,,,
MI10001,MaterialItem,Attacker,카알 대검,thumbnail://444f1da6365d4599a27bbfd207585856,ItemGuide_10,"재료 아이템, 공격력",,,,10,0,0,0,0,0,0,0,0,0,0,0,0
MI10002,MaterialItem,Attacker,워보우,thumbnail://3ffe515570ad435caa397ca0f2e2f83b,ItemGuide_11,"재료 아이템, 공격속도",,,,0,0,0,0,0,0,0,10,0,0,0,0,0
MI10003,MaterialItem,Defender,나무 방패,thumbnail://7d4cc6871503458bb8de7576c7047ef3,ItemGuide_12,"재료 아이템, 물리 방어",,,,0,0,0,0,0,20,0,0,0,0,0,0,0
MI10004,MaterialItem,Defender,낡은 고깔 모자,thumbnail://fa9ad14cb01e460b80e143dadfce3364,ItemGuide_13,"재료 아이템, 마법 방어",,,,0,0,0,0,0,0,20,0,0,0,0,0,0
MI10005,MaterialItem,Attacker,고목나무 스태프,thumbnail://2bb5fd1f15984d6b8ae81e9dd7a5cba9,ItemGuide_14,"재료 아이템, 주문력",,,,0,10,0,0,0,0,0,0,0,0,0,0,0
MI10006,MaterialItem,"Attacker,Defender",허름한 망토,thumbnail://c33def64db8b48f39b7b125fab1092e1,ItemGuide_15,"재료 아이템, 최대 마나",,,,0,0,0,0,15,0,0,0,0,0,0,0,0
MI10007,MaterialItem,Defender,노가다 목장갑,thumbnail://2e58683f2f094f099a0813c36e278dd5,ItemGuide_16,"재료 아이템, 최대 체력",,,,0,0,150,0,0,0,0,0,0,0,0,0,0
MI10008,MaterialItem,Attacker,추 귀고리,thumbnail://568d83943c74456680788e184819b1ab,ItemGuide_17,"재료 아이템, 크리티컬 확률",,,,0,0,0,0,0,0,0,0,0,20,0,0,0
NI10001,NormalItem,"MI10001,MI10001",화염의 카타나,thumbnail://b7884d08a2e546b9b6994248a7069b76,ItemGuide_18,공격력 증폭,전투 시작 후 5초마다 공격력 +15% (중첩 가능),,,30,0,0,0,0,0,0,0,0,0,0,0,0
NI10002,NormalItem,"MI10001,MI10007",스틸 미셀,thumbnail://22f978b94d72488692b7dd2889c7d2e0,ItemGuide_19,"상태이상 면역, 보호막","전투 시작 후 14초간 <B>저지 불가</b>. 전투 당 1번, 남은 체력이 30%가 되면 최대 체력의 20%만큼 보호막 획득.",SE0016,,15,0,300,0,0,0,0,0,0,0,0,0,0
NI10003,NormalItem,"MI10001,MI10004",용기의 날개,thumbnail://7228761e2bff44658ff49294345365da,ItemGuide_20,"흡혈, 치유","흡혈 +20%, 가해량의 20%만큼 가장 체력이 낮은 아군을 치유",,,15,0,0,0,0,0,25,0,0,0,0,0,0
NI10004,NormalItem,"MI10001,MI10003",도깨비 방망이,thumbnail://9f3a7c2e67c546e9b35816a10ca67823,ItemGuide_21,"흡혈, 생존","흡혈 +20%, 체력이 60%가 되면 2초간 <b>은신</b> 및 <b>무적</b>",SE0001,SE0002,15,0,0,0,0,25,0,0,0,0,0,0,0
NI10005,NormalItem,"MI10001,MI10005",드래곤 레이지,thumbnail://c7968102cc074308869642757340d928,ItemGuide_22,가해량 증폭,최종 가해량 +20%,,,15,15,0,0,0,0,0,0,0,0,0,0,0
NI10006,NormalItem,"MI10001,MI10008",소드 귀고리,thumbnail://33971a452aef4894a802e70110437c47,ItemGuide_36,"화상, 회복력 감소",기본 공격 및 스킬로 피해를 입힌 대상을 6초동안 화상 및 회복력 감소 상태로 만듭니다. 화상 상태인 적을 공격 시 8%의 추가 고정 피해를 입힙니다.,SE0010,SE0017,10,0,0,0,0,0,0,0,0,20,0,0,0
NI10007,NormalItem,"MI10001,MI10006",뿅망치,thumbnail://08171bf93fac4ad4a914409d44865283,ItemGuide_37,"마나 과부하, 가해량 증가",물리 공격 적중 시 20% 확률로 대상을 마나 과부하 상태로 만듭니다. 이 효과로 적을 마나 과부하 상태로 만들 때마다 전투 종료 시까지 최종 가해량이 4% 증가합니다. (중첩 가능),SE0013,,15,0,0,0,15,0,0,0,0,0,0,0,0
NI10008,NormalItem,"MI10001,MI10002",붉은 채찍,thumbnail://a9a329f2760e469bbbc4e87dcba14e20,ItemGuide_23,추가 물리 피해,기본 공격 적중 3회마다 대상 주변 1칸 내 모든 적에게 35%의 추가 물리 피해,,,15,0,0,0,0,0,0,15,0,0,0,0,0
NI10009,NormalItem,"MI10002,MI10002",신속의 날개,thumbnail://13812e94424b4f5da77beb6d60bea108,ItemGuide_24,공격속도 점차 증가,기본 공격 시 공격속도 +3% (중첩 가능),,,0,0,0,0,0,0,0,20,0,0,0,0,0
NI10010,NormalItem,"MI10002,MI10003",냄비 뚜껑,thumbnail://cac1c0e955b541ca9e7c766a9a4b57c5,StatusEffect_Name_SE0008,물리 방어 약화,"기본 공격 및 스킬 적중 대상을 4초간 물리 방어 약화 상태로 만듭니다. 물리 방어 약화 상태인 적을 공격 시, 8%의 추가 고정 피해를 입힙니다.",SE0008,,0,0,0,0,0,20,0,20,0,0,0,0,0
NI10011,NormalItem,"MI10002,MI10004",화이트 네쉐르,thumbnail://20466263d9b845509f1f2cc9dd898357,StatusEffect_Name_SE0009,마법 방어 약화,"기본 공격 및 스킬 적중 대상을 4초간 마법 방어 약화 상태로 만듭니다. 마법 방어 약화 상태인 적을 공격 시, 6%의 추가 고정 피해를 입힙니다.",SE0009,,0,0,0,0,0,0,20,20,0,0,0,0,0
NI10012,NormalItem,"MI10002,MI10005",드래곤 샤인 보우,thumbnail://ed83963681d448f08ecad5d78292d08e,ItemGuide_25,추가 마법 피해,스킬 사용 후 다음 기본 공격시 마력의 200%에 해당하는 추가 마법 피해를 줍니다.,,,0,15,0,0,0,0,0,15,0,0,0,0,0
NI10013,NormalItem,"MI10002,MI10008",자유로운 궁수의 귀고리,thumbnail://eac268b5e37d4f3399cea164d1810023,ItemGuide_26,"사거리 증가,크리티컬 확률 증가",공격 사거리 +1,,,0,0,0,0,0,0,0,15,0,20,0,0,0
NI10014,NormalItem,"MI10002,MI10006",공작 깃털 망토,thumbnail://c805ef092a4540ccbc8010fab4bc7d23,ItemGuide_31,마나 획득 증가,기본 공격 시 추가 마나 5 획득,,,0,0,0,0,15,0,0,20,0,0,0,0,0
NI10015,NormalItem,"MI10002,MI10007",파란색 권투 글러브,thumbnail://24c8cc2941a047fa9c3e9797c1f7dc82,ItemGuide_27,"공격력,주문력,공격속도 점차 증가","공격하거나 피해를 받으면 입는 피해량 -0.4%, 가해량 +0.8% (최대 25스택)",,,0,0,300,0,0,0,0,10,0,0,0,0,0
NI10016,NormalItem,"MI10003,MI10003",미스릴 타워 실드,thumbnail://0ba40d2cb18e4f10996ffef8d7f6b58b,ItemGuide_28,물리 방어 특화,입는 피해량 -10%,,,0,0,0,0,0,65,0,0,0,0,0,0,0
NI10017,NormalItem,"MI10003,MI10004",에스터 실드,thumbnail://cf9c4cf00867437a972e6bdfd6727274,ItemGuide_29,아군 보호 특화,"전투 시작: 본인을 제외한 주변 1칸 내 아군에게 물리 방어력 +20, 마법방어력 +20 제공 ",,,0,0,0,0,0,20,20,0,0,0,0,0,0
NI10018,NormalItem,"MI10003,MI10005",표고 버섯,thumbnail://e9b775b98f2b4dcb98897b32d0746e68,ItemGuide_21,"흡혈, 생존","흡혈 +20%, 체력이 60%가 되면 2초간 은신 및 무적",SE0001,SE0002,0,20,0,0,0,25,0,0,0,0,0,0,0
NI10019,NormalItem,"MI10003,MI10008",타임리스 귀고리,thumbnail://03ba11c060cf420b94593e0da2d7aef1,ItemGuide_30,"추가 물리 피해, 물리 방어 감소","2초마다 파동을 일으켜 주변 2칸 내 무작위 적 하나에게 60의 물리 피해를 입히고, 6초간 물리 방어 약화 적용",SE0008,,0,0,0,0,0,30,0,0,0,20,0,0,0
NI10020,NormalItem,"MI10003,MI10006",에르다의 빛,thumbnail://1a4bb6c262674eea8d6f57ad7bca04d6,ItemGuide_31,마나 획득 증가,"피격 시 얻는 MP +1, 스킬 사용 시 4초 동안 최대 마나의 100%만큼 보호막 획득",,,0,0,0,0,30,20,0,0,0,0,0,0,0
NI10021,NormalItem,"MI10003,MI10007",파란색 가운,thumbnail://3981fe513b8a43e1a1f0b58807aa7792,ItemGuide_32,회복,2초마다 최대 체력의 3% 회복,,,0,0,300,0,0,20,0,0,0,0,0,0,0
NI10022,NormalItem,"MI10004,MI10004",자쿰의 투구,thumbnail://81c8cb83df334a599bc6ef68b63a894b,ItemGuide_33,마법 방어 특화,입는 피해량 -10%,,,0,0,0,0,0,0,65,0,0,0,0,0,0
NI10023,NormalItem,"MI10004,MI10005",백의의 서,thumbnail://da6f85e824e74a9da16e4766bfb17228,ItemGuide_20,"흡혈, 치유","흡혈 +20%, 가해량의 20%만큼 체력 비율이 가장 낮은 아군 치유",,,0,15,0,0,0,0,20,0,0,0,0,0,0
NI10024,NormalItem,"MI10004,MI10008",사파이어 귀고리,thumbnail://2193c7293fb244d4a4b1d91e7a6004d9,ItemGuide_34,"추가 마법 피해, 마법 방어 감소","2초마다 마법 폭발을 일으켜 주변 2칸 내 무작위 적 하나에게 60의 마법 피해를 입히고, 6초간 마법 방어 약화 적용",SE0009,,0,0,0,0,0,0,30,0,0,20,0,0,0
NI10025,NormalItem,"MI10004,MI10006",플루토 플레임 망토,thumbnail://daf62e96c7d842deb49c4af92a7a3a2f,ItemGuide_31,마나 획득 증가,"피격 시 얻는 MP +1, 스킬 사용 시 4초 동안 최대 마나의 100%만큼 보호막 획득",,,0,0,0,0,30,0,20,0,0,0,0,0,0
NI10026,NormalItem,"MI10004,MI10007",하트 팔찌,thumbnail://df4eda9614314971bf31a4d643b468f9,ItemGuide_32,회복,2초마다 최대 체력의 3% 회복,,,0,0,300,0,0,0,20,0,0,0,0,0,0
NI10027,NormalItem,"MI10005,MI10005",자쿰의 나뭇가지,thumbnail://66f0427e33a04e7dbfa280ec19541452,ItemGuide_35,마력 증폭,전투 시작 후 5초마다 마력 +15% (중첩 가능),,,0,30,0,0,0,0,0,0,0,0,0,0,0
NI10028,NormalItem,"MI10005,MI10008",레드 해골 귀고리,thumbnail://3c47c4b9711448f0b0a14b03ed076118,ItemGuide_36,"화상, 회복력 감소",기본 공격 및 스킬로 피해를 입힌 대상을 6초동안 화상 및 회복력 감소 상태로 만듭니다. 화상 상태인 적을 공격시 6%의 추가 고정 피해를 입힙니다.,SE0010,SE0017,0,10,0,0,0,0,0,0,0,20,0,0,0
NI10029,NormalItem,"MI10005,MI10006",다이몬의 완드,thumbnail://39fb76eb3831486395bba411dea379eb,ItemGuide_37,"마나 과부하, 가해량 증가",마법 공격 적중 시 30% 확률로 대상을 마나 과부하 상태로 만듭니다. 이 효과로 적을 마나 과부하 상태로 만들 때마다 전투 종료 시까지 최종 가해량이 4% 증가합니다. (중첩 가능),SE0013,,0,30,0,0,20,0,0,0,0,0,0,0,0
NI10030,NormalItem,"MI10005,MI10007",별빛 팔찌,thumbnail://4cc43431cf914b98ae761aba2535e840,ItemGuide_19,"상태이상 면역, 보호막","전투 시작 후 15초간 저지 불가. 전투 당 1번, 남은 체력이 30%가 되면 최대 체력의 20%만큼 보호막 획득.",SE0016,,0,15,300,0,0,0,0,0,0,0,0,0,0
NI10031,NormalItem,"MI10008,MI10008",커맨더 포스 귀고리,thumbnail://56b026a6768b4f1cab7f0b50b39f4b7f,ItemGuide_38,크리티컬 데미지 증가,크리티컬 데미지 +25%,,,0,0,0,0,0,0,0,0,0,50,0,0,0
NI10032,NormalItem,"MI10006,MI10008",골드 드롭 귀고리,thumbnail://029a0890fa9e4884ad28a7c66da3be78,ItemGuide_39,크리티컬 확률 증가,스킬 사용 시 MP MAX의 30%만큼 크리티컬 확률 증가 (중첩 가능),,,0,0,0,0,15,0,0,0,0,20,0,0,0
NI10033,NormalItem,"MI10007,MI10008",산타 장갑,thumbnail://01e390ebbe744c8cab3e336b71466c9a,ItemGuide_40,랜덤 아이템 2개 장착,무작위 아이템 2개를 장착. 이 아이템 착용 시 다른 아이템 장착 불가.,,,0,0,150,0,0,0,0,0,0,20,0,0,0
NI10034,NormalItem,"MI10006,MI10006",스피릿 나인테일,thumbnail://5ca691d611de4e1b8373a2bbb500926d,ItemGuide_41,MP 공급,"스킬 사용 시, 가장 가까운 아군 1명 및 자신에게 MP 10 제공",,,10,10,0,0,30,0,0,0,0,0,0,0,0
NI10035,NormalItem,"MI10006,MI10007",파란색 날개 가방,thumbnail://a8766bd395974c13a586ebc05b3b1735,ItemGuide_42,보호막,"스킬 사용 시, 자신을 제외한 체력 비율이 가장 낮은 아군에게 4초간 소모한 마나의 200%만큼 보호막 부여",,,0,0,300,0,15,0,0,0,0,0,0,0,0
NI10036,NormalItem,"MI10007,MI10007",하트 타투 글로브,thumbnail://dc101f7119e04fbda189cdf674ca5efc,Status_MaxHP,최대 체력,최대 체력 +9%,,,0,0,600,0,0,0,0,0,0,0,0,0,0
EI10001,Emblem,,마스코트 상징,52a92954026b441b8fd61afac12e0440,ItemGuide_43,상징,장착한 유닛이 마스코트 시너지를 얻습니다. 이미 마스코트 시너지를 갖고 있는 캐릭터에게는 장착할 수 없습니다.,,,0,0,0,0,0,0,0,0,0,0,0,0,0
EI10002,Emblem,,수호대 상징,47cf9bba06c740b587f9f02e24262f37,ItemGuide_43,상징,장착한 유닛이 수호대 시너지를 얻습니다. 이미 수호대 시너지를 갖고 있는 캐릭터에게는 장착할 수 없습니다.,,,0,0,0,0,0,0,0,0,0,0,0,0,0
EI10003,Emblem,,선봉장 상징,bd8b548c7d4f4b97a89596d80f9f0fe4,ItemGuide_43,상징,장착한 유닛이 선봉장 시너지를 얻습니다. 이미 선봉장 시너지를 갖고 있는 캐릭터에게는 장착할 수 없습니다.,,,0,0,0,0,0,0,0,0,0,0,0,0,0
EI10004,Emblem,,마법사 상징,c946cf2994084762a74592ba0d6d9272,ItemGuide_43,상징,장착한 유닛이 마법사 시너지를 얻습니다. 이미 마법사 시너지를 갖고 있는 캐릭터에게는 장착할 수 없습니다.,,,0,0,0,0,0,0,0,0,0,0,0,0,0
EI10005,Emblem,,책사 상징,4a95515bf5384a4cbc55c60b5fd19d2b,ItemGuide_43,상징,장착한 유닛이 책사 시너지를 얻습니다. 이미 책사 시너지를 갖고 있는 캐릭터에게는 장착할 수 없습니다.,,,0,0,0,0,0,0,0,0,0,0,0,0,0
EI10006,Emblem,,사냥꾼 상징,ad97acb3e9e64c6383f049fc40b0455c,ItemGuide_43,상징,장착한 유닛이 사냥꾼 시너지를 얻습니다. 이미 사냥꾼 시너지를 갖고 있는 캐릭터에게는 장착할 수 없습니다.,,,0,0,0,0,0,0,0,0,0,0,0,0,0
EI10008,Emblem,,추격자 상징,e9fb7f86abe640c9a4e9ab116657d084,ItemGuide_43,상징,장착한 유닛이 추격자 시너지를 얻습니다. 이미 추격자 시너지를 갖고 있는 캐릭터에게는 장착할 수 없습니다.,,,0,0,0,0,0,0,0,0,0,0,0,0,0
EI10009,Emblem,,싸움꾼 상징,b48765da501547e6bad911f573691bce,ItemGuide_43,상징,장착한 유닛이 싸움꾼 시너지를 얻습니다. 이미 싸움꾼 시너지를 갖고 있는 캐릭터에게는 장착할 수 없습니다.,,,0,0,0,0,0,0,0,0,0,0,0,0,0
EI10010,Emblem,,저격수 상징,272fafb29e67409ab2e143b2bd301906,ItemGuide_43,상징,장착한 유닛이 저격수 시너지를 얻습니다. 이미 저격수 시너지를 갖고 있는 캐릭터에게는 장착할 수 없습니다.,,,0,0,0,0,0,0,0,0,0,0,0,0,0
EI10011,Emblem,,방해꾼 상징,d904892571144689a127696590e607dd,ItemGuide_43,상징,장착한 유닛이 방해꾼 시너지를 얻습니다. 이미 방해꾼 시너지를 갖고 있는 캐릭터에게는 장착할 수 없습니다.,,,0,0,0,0,0,0,0,0,0,0,0,0,0
EI10015,Emblem,,시간의 신전 상징,a4e356abeb6e44219d019aaec5b0cd16,ItemGuide_43,상징,장착한 유닛이 시간의 신전 시너지를 얻습니다. 이미 시간의 신전 시너지를 갖고 있는 캐릭터에게는 장착할 수 없습니다.,,,0,0,0,0,0,0,0,0,0,0,0,0,0
EI10016,Emblem,,엘나스 상징,9f069b75ff544317be68c7eedb004144,ItemGuide_43,상징,장착한 유닛이 엘나스 시너지를 얻습니다. 이미 엘나스 시너지를 갖고 있는 캐릭터에게는 장착할 수 없습니다.,,,0,0,0,0,0,0,0,0,0,0,0,0,0
EI10017,Emblem,,빅토리아아일랜드 상징,5a15f7a25b834d3abc825e81ab20c22e,ItemGuide_43,상징,장착한 유닛이 빅토리아아일랜드 시너지를 얻습니다. 이미 빅토리아아일랜드 시너지를 갖고 있는 캐릭터에게는 장착할 수 없습니다.,,,0,0,0,0,0,0,0,0,0,0,0,0,0
EI10018,Emblem,,슬리피우드 상징,c6b02a5bb88448b38e446d50d5906da5,ItemGuide_43,상징,장착한 유닛이 슬리피우드 시너지를 얻습니다. 이미 슬리피우드 시너지를 갖고 있는 캐릭터에게는 장착할 수 없습니다.,,,0,0,0,0,0,0,0,0,0,0,0,0,0
EI10019,Emblem,,루디브리엄 상징,03833fe422ab46a5b15755fb7402051a,ItemGuide_43,상징,장착한 유닛이 루디브리엄 시너지를 얻습니다. 이미 루디브리엄 시너지를 갖고 있는 캐릭터에게는 장착할 수 없습니다.,,,0,0,0,0,0,0,0,0,0,0,0,0,0
EI10021,Emblem,,오르비스 상징,0cd46b5631a74a1090856dee6dd2c179,ItemGuide_43,상징,장착한 유닛이 오르비스 시너지를 얻습니다. 이미 오르비스 시너지를 갖고 있는 캐릭터에게는 장착할 수 없습니다.,,,0,0,0,0,0,0,0,0,0,0,0,0,0
EI10022,Emblem,,시그너스 상징,feb4f029702843a6ab2862538fed408b,ItemGuide_43,상징,장착한 유닛이 시그너스 시너지를 얻습니다. 이미 시그너스 시너지를 갖고 있는 캐릭터에게는 장착할 수 없습니다.,,,0,0,0,0,0,0,0,0,0,0,0,0,0
EI10023,Emblem,,모험가 상징,6d6dbf3ec820492ca1b424abaa68aa0e,ItemGuide_43,상징,장착한 유닛이 모험가 시너지를 얻습니다. 이미 모험가 시너지를 갖고 있는 캐릭터에게는 장착할 수 없습니다.,,,0,0,0,0,0,0,0,0,0,0,0,0,0
EI10025,Emblem,,기사단장 상징,f9c8d41643f64345b135356a2609a916,ItemGuide_43,상징,장착한 유닛이 기사단장 시너지를 얻습니다. 이미 기사단장 시너지를 갖고 있는 캐릭터에게는 장착할 수 없습니다.,,,0,0,0,0,0,0,0,0,0,0,0,0,0
EI10031,Emblem,,아랫마을 상징,a48c7d20cada41e485aa1d965b13f89f,ItemGuide_43,상징,장착한 유닛이 아랫마을 시너지를 얻습니다. 이미 아랫마을 시너지를 갖고 있는 캐릭터에게는 장착할 수 없습니다.,,,0,0,0,0,0,0,0,0,0,0,0,0,0
EI10032,Emblem,,마가티아 상징,80f550924f4847ac8b4622d2b79e26a3,ItemGuide_43,상징,장착한 유닛이 마가티아 시너지를 얻습니다. 이미 마가티아 시너지를 갖고 있는 캐릭터에게는 장착할 수 없습니다.,,,0,0,0,0,0,0,0,0,0,0,0,0,0
EI10033,Emblem,,미우미우 상징,98e256e1616d425fb09fa56d29446f6d,ItemGuide_43,상징,장착한 유닛이 미우미우 시너지를 얻습니다. 이미 미우미우 시너지를 갖고 있는 캐릭터에게는 장착할 수 없습니다.,,,0,0,0,0,0,0,0,0,0,0,0,0,0
EI10034,Emblem,,처형자 상징,0d4039292f794cd2ab7b7f022abb36c8,ItemGuide_43,상징,장착한 유닛이 처형자 시너지를 얻습니다. 이미 처형자 시너지를 갖고 있는 캐릭터에게는 장착할 수 없습니다.,,,0,0,0,0,0,0,0,0,0,0,0,0,0
EI10035,Emblem,,결투가 상징,b0837ae53c8944319b69c6a913f9de5e,ItemGuide_43,상징,장착한 유닛이 결투가 시너지를 얻습니다. 이미 결투가 시너지를 갖고 있는 캐릭터에게는 장착할 수 없습니다.,,,0,0,0,0,0,0,0,0,0,0,0,0,0
EI10036,Emblem,,판타스틱 테마파크 상징,6106964e40774e57a5f0b0e7e4f17139,ItemGuide_43,상징,장착한 유닛이 판타스틱 테마파크 시너지를 얻습니다. 이미 판타스틱 테마파크 시너지를 갖고 있는 캐릭터에게는 장착할 수 없습니다.,,,0,0,0,0,0,0,0,0,0,0,0,0,0
SI10001,SynergyItem,,방해꾼의 가면,72054909b43947e593d12b43d7cea4df,ItemGuide_44,"은신, 그리고 은신",아군 방해꾼 캐릭터 중 하나에게 가면을 줄 수 있습니다. 전투 시작 시 가면을 가진 아군 캐릭터와 반대편에 있는 적 캐릭터가 서로 위치를 바꿉니다. 위치를 바꾼 아군 방해꾼은 <b>은신</b> 상태가 됩니다.,SE0002,,0,0,0,0,0,0,0,0,0,0,0,0,0
SI10002,SynergyItem,,분노의 옥석,a3ab9993bee449b9a4dd62b573879d5f,ItemGuide_45,불사,"죽기 직전, 체력 0인 상태로 3초간 무적",SE0001,,0,0,0,0,0,0,0,0,0,20,10,0,50
SI10003,SynergyItem,,질투의 옥석,6b50fad9deb94c6b9a2feaedf0d681e5,ItemGuide_46,방어 특화,"전투 시작 시, 인접한 유닛 수마다 방어력 및 마법 방어력 15씩 증가",,,0,0,100,0,0,40,40,0,0,0,0,0,0
SI10004,SynergyItem,,식탐의 옥석,9d32bc03080e4188b3d52d659132da4b,ItemGuide_47,처치 시 체력 회복 및 흡혈 증가,상대 유닛을 처치할 때마다 체력 200 회복하고 흡혈 5% 증가,,,0,0,300,0,0,0,0,0,0,0,0,0,0
SI10005,SynergyItem,,후회의 옥석,e9258b5f42aa433484f44c67be2b8adf,ItemGuide_23,추가 물리 피해,"전투 시작 10초 후, 기본 공격 적중 시 30의 고정 데미지 추가",,,20,20,0,0,20,0,0,0,0,0,0,0,0
SI10006,SynergyItem,,나태의 옥석,851488670ac94b47ad16b11100677214,StatusEffect_Name_SE0004,기절,"기본 공격 시 상대는 1.5초 기절, 자신은 1초 기절",SE0004,,0,15,200,0,0,0,0,0,0,0,0,0,0
SI10007,SynergyItem,,탐욕의 옥석,f370de9268874de2821af30d6db4b3d4,ItemGuide_48,골드 획득,"기본 공격 시, 2% 확률로 골드 1원 획득",,,0,0,0,0,0,0,0,30,0,0,0,0,0
SI10008,SynergyItem,,시기의 옥석,f2f2b00977dd42aaad3a675a661368ae,ItemGuide_49,만능,"전투 시작 시, 가해량 +100%, 피해량 -50%, 공속 +300%",,,50,50,400,0,0,0,0,0,0,0,0,0,0
